{
  "$schema": "http://json-schema.org/draft-07/schema#",
  "title": "BlueprintSchema",
  "type": "object",
  "additionalProperties": false,
  "properties": {
    "blueprintVersion": {
      "type": "string",
      "format": "blueprint-semver"
    },
    "instanceId": {
      "type": "string",
      "pattern": "^[a-z0-9]+(?:-[a-z0-9]+)*$"
    },
    "clientName": {
      "type": "string",
      "pattern": "^[^\\s\\r\\n]+(?:[ \\t]+[^\\s\\r\\n]+)*$"
    },
    "coreType": {
      "type": "string"
    },
    "vertical": {
      "type": "string"
    },
    "branding": {
      "type": "object",
      "additionalProperties": false,
      "properties": {
        "paletteChoice": {
          "type": "string",
          "enum": [
            "emerald",
            "ruby",
            "violet",
            "amber",
            "custom"
          ]
        },
        "primaryColor": {
          "type": "string",
          "format": "hsl-color"
        },
        "secondaryColor": {
          "type": "string",
          "format": "hsl-color"
        }
      },
      "required": ["paletteChoice"],
      "if": {
        "properties": {
          "paletteChoice": { "const": "custom" }
        }
      },
      "then": {
        "properties": {
          "primaryColor": { "type": "string" },
          "secondaryColor": { "type": "string" }
        },
        "required": ["primaryColor", "secondaryColor"]
      },
      "else": {
        "properties": {
          "primaryColor": { "type": "string" },
          "secondaryColor": { "type": "string" }
        },
        "not": {
          "anyOf": [
            {
              "properties": { "primaryColor": { "type": "string" } },
              "required": ["primaryColor"]
            },
            {
              "properties": { "secondaryColor": { "type": "string" } },
              "required": ["secondaryColor"]
            }
          ]
        }
      }
    },
    "features": {
      "type": "array",
      "uniqueItems": true,
      "items": {
        "type": "string",
        "pattern": "^[a-z]+(?:-[a-z]+)*$"
      }
    },
    "components": {
      "type": "array",
      "uniqueItems": true,
      "items": {
        "type": "string",
        "pattern": "^[A-Z][a-zA-Z0-9]*$"
      }
    },
    "patterns": {
      "type": "array",
      "uniqueItems": true,
      "items": {
        "type": "string",
        "pattern": "^pattern-[a-z]+(?:-[a-z]+)*$"
      }
    }
  },
  "required": [
    "blueprintVersion",
    "instanceId",
    "clientName",
    "coreType",
    "vertical",
    "branding",
    "features",
    "components",
    "patterns"
  ]
}
