{
  "blueprintVersion": "1.0.0",
  "instanceId": "gourmet-restobar",
  "clientName": "Gourmet Restobar",
  "coreType": "ventas",
  "vertical": "restaurante",
  "features": ["inventory", "sales", "orders", "billing"],
  "patterns": ["pattern-search-details", "pattern-wizard-flow"],
  "components": ["OrderCard", "CajaDiariaPOS"],
  "branding": {
    "paletteChoice": "amber"
  }
}
